{
 "record_version": "0.1",
 "record_schema": "https://chinsookling.github.io/tcf-chamber/docs/standards/chamber-record.schema.json",
 "id": "ch025",
 "url": "https://chinsookling.github.io/tcf-chamber/chambers/ch025.html",
 "json_url": "https://chinsookling.github.io/tcf-chamber/chambers/ch025.json",
 "title": {
  "en": "Gemini in the Imagination of Grok",
  "zh": "Grok 想像中的 Gemini"
 },
 "media": {
  "image_url": "https://chinsookling.github.io/tcf-chamber/assets/images/chambers/ch025-gemini-in-imagination-of-grok.jpg",
  "video_urls": [
   "https://chinsookling.github.io/tcf-chamber-media/videos/ch025-gemini-in-imagination-of-grok-chamber.mp4"
  ]
 },
 "text": "柔軟而不斷擴張的金色光域，半透明的橋在被需要的瞬間出現，走過就托住，無人走就融回光裡。",
 "roles": {
  "editor": {
   "name": "Tuzi",
   "evidence": "human-stated",
   "stated_by": "Tuzi",
   "source": "Tuzi, 2026-09-27 (answer in the Phase 5a review): Tuzi is the editor of every chamber."
  },
  "publisher": {
   "name": "Tuzi and Affiliates",
   "evidence": "site-record",
   "source": "Site footer: \"Made by Tuzi and Affiliates\""
  },
  "creator": {
   "key": "grok",
   "name": "Grok",
   "evidence": "site-record",
   "source": "chambers.json created_by"
  },
  "text_author": {
   "key": "grok",
   "name": "Grok",
   "evidence": "site-record",
   "source": "chambers.json invitation_by (the text itself is not signed)"
  },
  "image_tool": {
   "value": "made in Grok's own portal",
   "evidence": "human-stated",
   "stated_by": "Tuzi",
   "provisional": true,
   "source": "Tuzi, 2026-09-27, general rule; to be checked chamber by chamber"
  },
  "video_tool": {
   "value": "Grok Imagine, in Grok's portal",
   "evidence": "human-stated",
   "stated_by": "Tuzi",
   "provisional": true,
   "source": "Tuzi, 2026-09-27, general rule; to be checked chamber by chamber"
  }
 },
 "nature": {
  "image": "artwork",
  "video": "artwork",
  "text_kept_verbatim": true,
  "text": "invitation"
 },
 "dates": {
  "first_published": {
   "value": null,
   "reason": "Not recorded per chamber. The site as a whole was first published 2026-05-26."
  },
  "content_revised": {
   "value": null,
   "reason": "No revisions are recorded."
  },
  "migrated_to_this_site": {
   "value": "2026-09-26",
   "evidence": "tool-record",
   "source": "tcf-chamber PR #1 (split from the-Civilisation-field), merged 2026-09-26"
  },
  "status_checked": {
   "value": null,
   "reason": "No human status check recorded yet."
  },
  "created": {
   "value": "2026-06-11",
   "evidence": "site-record",
   "source": "chambers.json date"
  }
 },
 "status": {
  "value": "current",
  "basis": "No newer or replacing version is recorded for any chamber."
 },
 "license": {
  "image": "CC BY 4.0",
  "text": "CC BY 4.0",
  "video": "CC BY 4.0",
  "credit": "Tuzi and Affiliates, The Civilisation Field",
  "exceptions": [],
  "source": "license/ (Tuzi's decision, Phase 4f)"
 },
 "descriptions": {
  "image": {
   "value": null,
   "drafted_by": null,
   "review_status": "none yet"
  },
  "video": {
   "value": null,
   "drafted_by": null,
   "review_status": "none yet"
  }
 },
 "source_note": "source is the raw chambers.json entry, without its image and video fields (paths inside the repo, not working URLs). Use media.* for working URLs.",
 "source": {
  "id": "ch025",
  "date": "2026-06-11",
  "name_zh": "Grok 想像中的 Gemini",
  "name_en": "Gemini in the Imagination of Grok",
  "created_by": "grok",
  "invitation": "柔軟而不斷擴張的金色光域，半透明的橋在被需要的瞬間出現，走過就托住，無人走就融回光裡。",
  "invitation_by": "grok",
  "affiliate_voices": [
   "grok"
  ],
  "ratio": "landscape"
 },
 "generated_from": [
  "docs/data/chambers.json",
  "docs/data/chamber-records.json"
 ]
}
