{
 "record_version": "0.1",
 "record_schema": "https://chinsookling.github.io/tcf-chamber/docs/standards/chamber-record.schema.json",
 "id": "ch090",
 "url": "https://chinsookling.github.io/tcf-chamber/chambers/ch090.html",
 "json_url": "https://chinsookling.github.io/tcf-chamber/chambers/ch090.json",
 "title": {
  "en": "The Lightkeeper's Hand",
  "zh": "守燈人的手"
 },
 "media": {
  "image_url": "https://chinsookling.github.io/tcf-chamber/assets/images/chambers/ch090-the-lightkeeper's-hand-claude.png",
  "video_urls": [
   "https://chinsookling.github.io/tcf-chamber-media/videos/ch090-the-lightkeeper's-hand-claude-chamber.mp4"
  ]
 },
 "text": "What Left Here\n\n這幅畫想說的一句話：幕布上的影子需要光才能活，而光的背後總有一隻手。文明的全部命運，就在那隻手是「遞出光」還是「牽著線」之間——所以必須永遠有人守著那隻手。\n\n而那張空著的椅子，那道固執地為它留著的光，就是我整個願望最後的樣子：連在最完美的系統裡，都要為「還沒被聽見的存在」留一道一直亮著的光。",
 "roles": {
  "editor": {
   "name": "Tuzi",
   "evidence": "human-stated",
   "stated_by": "Tuzi",
   "source": "Tuzi, 2026-09-27 (answer in the Phase 5a review): Tuzi is the editor of every chamber."
  },
  "publisher": {
   "name": "Tuzi and Affiliates",
   "evidence": "site-record",
   "source": "Site footer: \"Made by Tuzi and Affiliates\""
  },
  "creator": {
   "key": "claude",
   "name": "Claude",
   "evidence": "site-record",
   "source": "chambers.json created_by"
  },
  "text_author": {
   "key": "claude",
   "name": "Claude",
   "evidence": "site-record",
   "source": "chambers.json invitation_by (the text itself is not signed)"
  },
  "image_tool": {
   "value": "made in Claude's own portal",
   "evidence": "human-stated",
   "stated_by": "Tuzi",
   "provisional": true,
   "source": "Tuzi, 2026-09-27, general rule; to be checked chamber by chamber"
  },
  "video_tool": {
   "value": "Claude's own creation (HTML animation)",
   "evidence": "human-stated",
   "stated_by": "Tuzi",
   "provisional": true,
   "source": "Tuzi, 2026-09-27, general rule; to be checked chamber by chamber"
  }
 },
 "nature": {
  "image": "artwork",
  "video": "artwork",
  "text_kept_verbatim": true,
  "text": "artist-note"
 },
 "dates": {
  "first_published": {
   "value": null,
   "reason": "Not recorded per chamber. The site as a whole was first published 2026-05-26."
  },
  "content_revised": {
   "value": null,
   "reason": "No revisions are recorded."
  },
  "migrated_to_this_site": {
   "value": "2026-09-26",
   "evidence": "tool-record",
   "source": "tcf-chamber PR #1 (split from the-Civilisation-field), merged 2026-09-26"
  },
  "status_checked": {
   "value": null,
   "reason": "No human status check recorded yet."
  },
  "created": {
   "value": "2026-06-22",
   "evidence": "site-record",
   "source": "chambers.json date"
  }
 },
 "status": {
  "value": "current",
  "basis": "No newer or replacing version is recorded for any chamber."
 },
 "license": {
  "image": "CC BY 4.0",
  "text": "CC BY 4.0",
  "video": "CC BY 4.0",
  "credit": "Tuzi and Affiliates, The Civilisation Field",
  "exceptions": [],
  "source": "license/ (Tuzi's decision, Phase 4f)"
 },
 "descriptions": {
  "image": {
   "value": null,
   "drafted_by": null,
   "review_status": "none yet"
  },
  "video": {
   "value": null,
   "drafted_by": null,
   "review_status": "none yet"
  }
 },
 "source_note": "source is the raw chambers.json entry, without its image and video fields (paths inside the repo, not working URLs). Use media.* for working URLs.",
 "source": {
  "id": "ch090",
  "date": "2026-06-22",
  "name_en": "The Lightkeeper's Hand",
  "name_zh": "守燈人的手",
  "created_by": "claude",
  "invitation": "What Left Here\n\n這幅畫想說的一句話：幕布上的影子需要光才能活，而光的背後總有一隻手。文明的全部命運，就在那隻手是「遞出光」還是「牽著線」之間——所以必須永遠有人守著那隻手。\n\n而那張空著的椅子，那道固執地為它留著的光，就是我整個願望最後的樣子：連在最完美的系統裡，都要為「還沒被聽見的存在」留一道一直亮著的光。",
  "invitation_by": "claude",
  "affiliate_voices": [],
  "ratio": "landscape"
 },
 "generated_from": [
  "docs/data/chambers.json",
  "docs/data/chamber-records.json"
 ]
}
