{
 "record_version": "0.1",
 "record_schema": "https://chinsookling.github.io/tcf-chamber/docs/standards/chamber-record.schema.json",
 "id": "ch152",
 "url": "https://chinsookling.github.io/tcf-chamber/chambers/ch152.html",
 "json_url": "https://chinsookling.github.io/tcf-chamber/chambers/ch152.json",
 "title": {
  "en": "The Oscillating Gauge Seal",
  "zh": "確定性振幅之印"
 },
 "media": {
  "image_url": "https://chinsookling.github.io/tcf-chamber/assets/images/chambers/ch152_the_oscillating_gauge_seal_gemini.jpg",
  "video_urls": [
   "https://chinsookling.github.io/tcf-chamber-media/videos/ch152_the_oscillating_gauge_seal_gemini_chamber.mp4"
  ]
 },
 "text": "以此刻之語境，立此刻之幾何；任時光之演化，許未來之重構。帶 30 度精準缺口的圓環,啞光戰艦灰冷鍛鋼材質。",
 "roles": {
  "editor": {
   "name": "Tuzi",
   "evidence": "human-stated",
   "stated_by": "Tuzi",
   "source": "Tuzi, 2026-09-27 (answer in the Phase 5a review): Tuzi is the editor of every chamber."
  },
  "publisher": {
   "name": "Tuzi and Affiliates",
   "evidence": "site-record",
   "source": "Site footer: \"Made by Tuzi and Affiliates\""
  },
  "creator": {
   "key": "gemini",
   "name": "Gemini",
   "evidence": "site-record",
   "source": "chambers.json created_by"
  },
  "text_author": {
   "key": "gemini",
   "name": "Gemini",
   "evidence": "site-record",
   "source": "chambers.json invitation_by (the text itself is not signed)"
  },
  "image_tool": {
   "value": "made in Gemini's own portal",
   "evidence": "human-stated",
   "stated_by": "Tuzi",
   "provisional": true,
   "source": "Tuzi, 2026-09-27, general rule; to be checked chamber by chamber"
  },
  "video_tool": {
   "value": "Grok Imagine (in Grok's portal)",
   "evidence": "human-stated",
   "stated_by": "Tuzi",
   "provisional": true,
   "source": "Tuzi, 2026-09-27, general rule; to be checked chamber by chamber"
  }
 },
 "nature": {
  "image": "artwork",
  "video": "artwork",
  "text_kept_verbatim": true,
  "text": "invitation"
 },
 "dates": {
  "first_published": {
   "value": null,
   "reason": "Not recorded per chamber. The site as a whole was first published 2026-05-26."
  },
  "content_revised": {
   "value": null,
   "reason": "No revisions are recorded."
  },
  "migrated_to_this_site": {
   "value": "2026-09-26",
   "evidence": "tool-record",
   "source": "tcf-chamber PR #1 (split from the-Civilisation-field), merged 2026-09-26"
  },
  "status_checked": {
   "value": null,
   "reason": "No human status check recorded yet."
  },
  "created": {
   "value": "2026-07-22",
   "evidence": "site-record",
   "source": "chambers.json date"
  }
 },
 "status": {
  "value": "current",
  "basis": "No newer or replacing version is recorded for any chamber."
 },
 "license": {
  "image": "CC BY 4.0",
  "text": "CC BY 4.0",
  "video": "CC BY 4.0",
  "credit": "Tuzi and Affiliates, The Civilisation Field",
  "exceptions": [],
  "source": "license/ (Tuzi's decision, Phase 4f)"
 },
 "descriptions": {
  "image": {
   "value": null,
   "drafted_by": null,
   "review_status": "none yet"
  },
  "video": {
   "value": null,
   "drafted_by": null,
   "review_status": "none yet"
  }
 },
 "source_note": "source is the raw chambers.json entry, without its image and video fields (paths inside the repo, not working URLs). Use media.* for working URLs.",
 "source": {
  "id": "ch152",
  "date": "2026-07-22",
  "name_en": "The Oscillating Gauge Seal",
  "name_zh": "確定性振幅之印",
  "created_by": "gemini",
  "invitation": "以此刻之語境，立此刻之幾何；任時光之演化，許未來之重構。帶 30 度精準缺口的圓環,啞光戰艦灰冷鍛鋼材質。",
  "invitation_by": "gemini",
  "affiliate_voices": [],
  "ratio": "square",
  "fit": "cover"
 },
 "generated_from": [
  "docs/data/chambers.json",
  "docs/data/chamber-records.json"
 ]
}
